,Enrichment FDR,nGenes,Pathway Genes,Fold Enrichment,Pathway,Genes,URL
,0.000522315435431,9,1231,8.37597362259282,MiR-187 target gene, vmp1  calcr  b3gat1a  aqp12  cacng1b  dvl2  srebf1  hoxc1a  hoxc8a,http://www.targetscan.org
,0.00666481004619,8,1433,6.39579656007553,Transmembrane transporter activity , slc1a4  cacna1ba  aqp12  cacng1b  ndufaf2  slc30a6  grin3bb  kcnk9, http://amigo.geneontology.org/amigo/term/GO:0022857
,0.00884250352817,8,1534,5.97469131068333,Transporter activity , slc1a4  cacna1ba  aqp12  cacng1b  ndufaf2  slc30a6  grin3bb  kcnk9, http://amigo.geneontology.org/amigo/term/GO:0005215
,9.72869848988813E-05,7,378,21.2156862745098,Somite, mapk14a  calcr  fzd8a  pld1a  myo18ab  dio2  pdlim7,https://amp.pharm.mssm.edu/FishEnrichr
,0.025967565595614,7,1501,5.34279108045617,Transmembrane transport , slc1a4  cacna1ba  aqp12  cacng1b  slc30a6  grin3bb  kcnk9, http://amigo.geneontology.org/amigo/term/GO:0055085
,0.000324912783325,6,333,20.6422893481717,Intermediate mesoderm, ldb2a  calcr  fzd8a  pld1a  myo18ab  pdlim7,https://amp.pharm.mssm.edu/FishEnrichr
,0.000324912783325,6,333,20.6422893481717,Lateral plate mesoderm, ldb2a  calcr  fzd8a  pld1a  myo18ab  pdlim7,https://amp.pharm.mssm.edu/FishEnrichr
,0.000324912783325,6,333,20.6422893481717,Mesoderm, ldb2a  calcr  fzd8a  pld1a  myo18ab  pdlim7,https://amp.pharm.mssm.edu/FishEnrichr
,0.000324912783325,6,333,20.6422893481717,Paraxial mesoderm, ldb2a  calcr  fzd8a  pld1a  myo18ab  pdlim7,https://amp.pharm.mssm.edu/FishEnrichr
,0.000324912783325,6,300,22.9129411764706,Somite development, calcr  fzd8a  pld1a  myo18ab  dio2  pdlim7,https://amp.pharm.mssm.edu/FishEnrichr
,0.000451733741237,6,368,18.6790281329923,Mesoderm development, ldb2a  calcr  fzd8a  pld1a  myo18ab  pdlim7,https://amp.pharm.mssm.edu/FishEnrichr
,0.000451733741237,6,368,18.6790281329923,Paraxial mesoderm development, ldb2a  calcr  fzd8a  pld1a  myo18ab  pdlim7,https://amp.pharm.mssm.edu/FishEnrichr
,0.000573056729461,6,403,17.0567800321121,Mesoderm formation, ldb2a  calcr  fzd8a  pld1a  myo18ab  pdlim7,https://amp.pharm.mssm.edu/FishEnrichr
,0.000573056729461,6,403,17.0567800321121,Paraxial mesoderm formation, ldb2a  calcr  fzd8a  pld1a  myo18ab  pdlim7,https://amp.pharm.mssm.edu/FishEnrichr
,0.001333693638268,5,276,20.7544757033248,Hypoblast, ldb2a  fzd8a  pld1a  myo18ab  pdlim7,https://amp.pharm.mssm.edu/FishEnrichr
,0.0058447638336,5,397,14.4288042672989,MAPK signaling pathway, mapk14a  cacna1ba  cacng1b  nfatc3a  pdgfc,http://www.genome.jp/kegg-bin/show_pathway?dre04010 
,0.025967565595614,5,735,7.79351740696279,Cation transmembrane transporter activity , cacna1ba  cacng1b  slc30a6  grin3bb  kcnk9, http://amigo.geneontology.org/amigo/term/GO:0008324
,0.025967565595614,5,650,8.81266968325792,Channel activity , cacna1ba  aqp12  cacng1b  grin3bb  kcnk9, http://amigo.geneontology.org/amigo/term/GO:0015267
,0.025967565595614,5,650,8.81266968325792,Passive transmembrane transporter activity , cacna1ba  aqp12  cacng1b  grin3bb  kcnk9, http://amigo.geneontology.org/amigo/term/GO:0022803
,0.050437217230391,5,1369,4.18424784084562,Protein phosphorylation , mapk14a  prkcha  slka  pkig  stk10, http://amigo.geneontology.org/amigo/term/GO:0006468
,0.050437217230391,5,1247,4.59361290626916,Ion transport , cacna1ba  cacng1b  slc30a6  grin3bb  kcnk9, http://amigo.geneontology.org/amigo/term/GO:0006811
,0.050437217230391,5,965,5.93599512343798,Ion transmembrane transporter activity , cacna1ba  cacng1b  slc30a6  grin3bb  kcnk9, http://amigo.geneontology.org/amigo/term/GO:0015075
,0.050454250443478,5,1573,3.64159904266856,Cell surface receptor signaling pathway , calcr  fzd8a  dvl2  pdgfc  grin3bb, http://amigo.geneontology.org/amigo/term/GO:0007166
,0.050871459410401,5,1586,3.61174987018767,Hif1ab-Hypoxia inducible factor 1 alpha target gene, SBNO2  ankrd12  iffo1b  nfatc3a  slc30a6,http://gtrd.biouml.org
,0.053104425149447,5,1605,3.56899395272128,MiR-196 target gene, mthfd1l  myo18ab  hoxc1a  hoxc8a  klf15,http://www.targetscan.org
,0.054126851578257,5,1618,3.54031847596888,Phosphorylation , mapk14a  prkcha  slka  pkig  stk10, http://amigo.geneontology.org/amigo/term/GO:0016310
,0.063014853700957,5,1698,3.37351901891499,Signal Transduction, prkcha  fzd8a  dvl2  pdgfc  chn1,https://reactome.org/download/current
,0.072722605908125,5,1781,3.21630280410873,Intracellular signal transduction , mapk14a  prkcha  dvl2  pld1a  chn1, http://amigo.geneontology.org/amigo/term/GO:0035556
,0.001019002047544,4,112,40.9159663865546,Axis, slc1a4  dvl2  srebf1  dio2,https://amp.pharm.mssm.edu/FishEnrichr
,0.004789723400725,4,174,26.3367139959432,Twitch skeletal muscle contraction, palld  myo18ab  hoxc8a  pdlim7,https://amp.pharm.mssm.edu/FishEnrichr
,0.004837302794626,4,177,25.8903290129611,Kidney epithelial cell, palld  pld1a  myo18ab  si:ch211-183d21.1,https://amp.pharm.mssm.edu/FishEnrichr
,0.005745942023282,4,190,24.1188854489164,Muscle organ development, palld  dvl2  hoxc8a  pdlim7,https://amp.pharm.mssm.edu/FishEnrichr
,0.005745942023282,4,190,24.1188854489164,Skeletal muscle tissue development, palld  dvl2  hoxc8a  pdlim7,https://amp.pharm.mssm.edu/FishEnrichr
,0.006667836087922,4,209,21.9262594990149,Wnt signaling pathway, wif1  fzd8a  dvl2  nfatc3a,http://www.genome.jp/kegg-bin/show_pathway?dre04310 
,0.00884250352817,4,231,19.8380443086325,Swimming, dvl2  srebf1  dio2  gap43,https://amp.pharm.mssm.edu/FishEnrichr
,0.018342212555029,4,289,15.8567066965194,Mesenchyme, wif1  ldb2a  myo18ab  pdlim7,https://amp.pharm.mssm.edu/FishEnrichr
,0.025967565595614,4,443,10.3444429690612,Cation channel activity , cacna1ba  cacng1b  grin3bb  kcnk9, http://amigo.geneontology.org/amigo/term/GO:0005261
,0.030797949830423,4,470,9.75018773466834,Actin binding , scin  myo18ab  si:dkey-178k16.1  myo16, http://amigo.geneontology.org/amigo/term/GO:0003779
,0.041574024294131,4,521,8.79575477023823,Animal organ morphogenesis, ldb2a  calcr  dio2  pdlim7,https://amp.pharm.mssm.edu/FishEnrichr
,0.050437217230391,4,847,5.41037572053615,Cation transport , cacna1ba  cacng1b  slc30a6  kcnk9, http://amigo.geneontology.org/amigo/term/GO:0006812
,0.050437217230391,4,563,8.13958833977641,Actin filament-based process , scin  myo18ab  si:dkey-178k16.1  myo16, http://amigo.geneontology.org/amigo/term/GO:0030029
,0.050437217230391,4,914,5.01377268631742,Ion transmembrane transport , cacna1ba  cacng1b  grin3bb  kcnk9, http://amigo.geneontology.org/amigo/term/GO:0034220
,0.050437217230391,4,677,6.76896341993223,Protein serine/threonine kinase activity , mapk14a  prkcha  slka  stk10, http://amigo.geneontology.org/amigo/term/GO:0004674
,0.050437217230391,4,576,7.95588235294118,Ion channel activity , cacna1ba  cacng1b  grin3bb  kcnk9, http://amigo.geneontology.org/amigo/term/GO:0005216
,0.050437217230391,4,778,5.89021624073794,Cytoskeletal protein binding , scin  myo18ab  si:dkey-178k16.1  myo16, http://amigo.geneontology.org/amigo/term/GO:0008092
,0.050437217230391,4,881,5.20157574948254,Inorganic molecular entity transmembrane transporter activity , cacna1ba  cacng1b  grin3bb  kcnk9, http://amigo.geneontology.org/amigo/term/GO:0015318
,0.050437217230391,4,701,6.537215742217,Inorganic cation transmembrane transporter activity , cacna1ba  cacng1b  grin3bb  kcnk9, http://amigo.geneontology.org/amigo/term/GO:0022890
,0.063098897548916,4,1112,4.12103258569615,Protein kinase activity , mapk14a  prkcha  slka  stk10, http://amigo.geneontology.org/amigo/term/GO:0004672
,0.069004927604301,4,1153,3.97449109739299,Cytoskeleton , myo18ab  iffo1b  si:dkey-178k16.1  myo16, http://amigo.geneontology.org/amigo/term/GO:0005856
,0.006559282118806,3,68,50.5432525951557,Somite 8, mapk14a  myo18ab  dio2,https://amp.pharm.mssm.edu/FishEnrichr
,0.016695299998451,3,102,33.6955017301038,Somite 4, mapk14a  calcr  fzd8a,https://amp.pharm.mssm.edu/FishEnrichr
,0.025967565595614,3,125,27.4955294117647,Response to chemical, srebf1  dio2  gap43,https://amp.pharm.mssm.edu/FishEnrichr
,0.025967565595614,3,189,18.1848739495798,Swimming behavior, srebf1  dio2  gap43,https://amp.pharm.mssm.edu/FishEnrichr
,0.025967565595614,3,179,19.2007886953664,Actin cytoskeleton organization, palld  pld1a  myo18ab,https://amp.pharm.mssm.edu/FishEnrichr
,0.025967565595614,3,179,19.2007886953664,Actin filament organization, palld  pld1a  myo18ab,https://amp.pharm.mssm.edu/FishEnrichr
,0.025967565595614,3,179,19.2007886953664,B cell differentiation, ldb2a  hoxc1a  gap43,https://amp.pharm.mssm.edu/FishEnrichr
,0.025967565595614,3,170,20.2173010380623,Calcium ion transport, palld  pld1a  myo18ab,https://amp.pharm.mssm.edu/FishEnrichr
,0.025967565595614,3,173,19.8667120027202,Cardiac muscle myoblast, palld  myo18ab  hoxc8a,https://amp.pharm.mssm.edu/FishEnrichr
,0.025967565595614,3,171,20.0990712074303,Cell proliferation in midbrain, ldb2a  fzd8a  hoxc1a,https://amp.pharm.mssm.edu/FishEnrichr
,0.025967565595614,3,182,18.8842921784098,Central nervous system neuron development, hoxc1a  hoxc8a  gap43,https://amp.pharm.mssm.edu/FishEnrichr
,0.025967565595614,3,165,20.8299465240642,Forebrain development, ldb2a  hoxc1a  gap43,https://amp.pharm.mssm.edu/FishEnrichr
,0.025967565595614,3,182,18.8842921784098,Hypothalamus development, ldb2a  hoxc1a  gap43,https://amp.pharm.mssm.edu/FishEnrichr
,0.025967565595614,3,144,23.8676470588235,Medulla oblongata, ldb2a  gap43  chn1,https://amp.pharm.mssm.edu/FishEnrichr
,0.025967565595614,3,167,20.5804860866502,Neuron development, ldb2a  hoxc1a  chn1,https://amp.pharm.mssm.edu/FishEnrichr
,0.025967565595614,3,179,19.2007886953664,Ossification, palld  dvl2  myo18ab,https://amp.pharm.mssm.edu/FishEnrichr
,0.025967565595614,3,163,21.0855286900036,Preoptic area, ldb2a  gap43  chn1,https://amp.pharm.mssm.edu/FishEnrichr
,0.025967565595614,3,176,19.5280748663102,Regulation of cellular pH reduction, palld  pld1a  si:ch211-183d21.1,https://amp.pharm.mssm.edu/FishEnrichr
,0.025967565595614,3,174,19.7525354969574,Regulation of protein kinase B signaling, palld  pld1a  si:ch211-183d21.1,https://amp.pharm.mssm.edu/FishEnrichr
,0.025967565595614,3,169,20.3369300382875,Reproductive behavior, aqp12  pld1a  dio2,https://amp.pharm.mssm.edu/FishEnrichr
,0.025967565595614,3,176,19.5280748663102,Skeletal muscle organ development, palld  myo18ab  hoxc8a,https://amp.pharm.mssm.edu/FishEnrichr
,0.025967565595614,3,184,18.6790281329923,Skeletal system development, palld  myo18ab  hoxc8a,https://amp.pharm.mssm.edu/FishEnrichr
,0.025967565595614,3,177,19.4177467597208,Skeletal system morphogenesis, palld  pld1a  myo18ab,https://amp.pharm.mssm.edu/FishEnrichr
,0.025967565595614,3,177,19.4177467597208,Skeletal tissue, palld  hoxc8a  pdlim7,https://amp.pharm.mssm.edu/FishEnrichr
,0.025967565595614,3,184,18.6790281329923,Spinal cord interneuron, hoxc1a  hoxc8a  gap43,https://amp.pharm.mssm.edu/FishEnrichr
,0.025967565595614,3,186,18.4781783681214,Striated muscle cell differentiation, palld  myo18ab  hoxc8a,https://amp.pharm.mssm.edu/FishEnrichr
,0.025967565595614,3,168,20.4579831932773,Somite 1, mapk14a  pld1a  dio2,https://amp.pharm.mssm.edu/FishEnrichr
,0.025967565595614,3,133,25.8416629809819,WP215 Noncanonical Wnt Pathway, wif1  fzd8a  dvl2,http://www.wikipathways.org/instance/WP215_r95547
,0.025967565595614,3,150,22.9129411764706,WP566 Canonical wnt signaling, wif1  fzd8a  dvl2,http://www.wikipathways.org/instance/WP566_r96484
,0.025967565595614,3,181,18.9886252843679,Cerebellar crest, mthfd1l  hoxc1a  hoxc8a,https://amp.pharm.mssm.edu/FishEnrichr
,0.025967565595614,3,159,21.6159822419534,Diencephalon, ldb2a  gap43  chn1,https://amp.pharm.mssm.edu/FishEnrichr
,0.025967565595614,3,185,18.5780604133545,Dorsal telencephalon, ldb2a  gap43  chn1,https://amp.pharm.mssm.edu/FishEnrichr
,0.025967565595614,3,159,21.6159822419534,Dorsal thalamus, ldb2a  gap43  chn1,https://amp.pharm.mssm.edu/FishEnrichr
,0.025967565595614,3,175,19.6396638655462,Mesangial cell, palld  pld1a  myo18ab,https://amp.pharm.mssm.edu/FishEnrichr
,0.025967565595614,3,169,20.3369300382875,Pericyte, palld  pld1a  myo18ab,https://amp.pharm.mssm.edu/FishEnrichr
,0.025967565595614,3,159,21.6159822419534,Thalamus, ldb2a  gap43  chn1,https://amp.pharm.mssm.edu/FishEnrichr
,0.025967565595614,3,172,19.9822161422709,Yolk, palld  aqp12  pld1a,https://amp.pharm.mssm.edu/FishEnrichr
,0.025967565595614,3,172,19.9822161422709,Barrier epithelial cell, palld  pld1a  myo18ab,https://amp.pharm.mssm.edu/FishEnrichr
,0.025967565595614,3,175,19.6396638655462,Renal vesicle, mthfd1l  hoxc1a  hoxc8a,https://amp.pharm.mssm.edu/FishEnrichr
,0.025967565595614,3,181,18.9886252843679,Antibiotic transport, palld  pld1a  si:ch211-183d21.1,https://amp.pharm.mssm.edu/FishEnrichr
,0.025967565595614,3,181,18.9886252843679,Cerebellar granule cell differentiation, hoxc1a  hoxc8a  gap43,https://amp.pharm.mssm.edu/FishEnrichr
,0.025967565595614,3,185,18.5780604133545,Cerebellar neuron development, hoxc1a  hoxc8a  gap43,https://amp.pharm.mssm.edu/FishEnrichr
,0.025967565595614,3,187,18.3793645800566,CoSA, hoxc1a  hoxc8a  gap43,https://amp.pharm.mssm.edu/FishEnrichr
,0.025967565595614,3,167,20.5804860866502,Dopamine biosynthetic process from tyrosine, ldb2a  gap43  chn1,https://amp.pharm.mssm.edu/FishEnrichr
,0.025967565595614,3,170,20.2173010380623,Golgi organization, palld  dvl2  pld1a,https://amp.pharm.mssm.edu/FishEnrichr
,0.025967565595614,3,182,18.8842921784098,Hepatocyte cell migration, palld  dvl2  pld1a,https://amp.pharm.mssm.edu/FishEnrichr
,0.025967565595614,3,168,20.4579831932773,Hindbrain commissure, ndufaf2  hoxc8a  gap43,https://amp.pharm.mssm.edu/FishEnrichr
,0.025967565595614,3,179,19.2007886953664,Hyosymplectic cartilage, palld  myo18ab  hoxc8a,https://amp.pharm.mssm.edu/FishEnrichr
,0.025967565595614,3,181,18.9886252843679,Integrin biosynthetic process, palld  pld1a  si:ch211-183d21.1,https://amp.pharm.mssm.edu/FishEnrichr
,0.025967565595614,3,186,18.4781783681214,Interkinetic nuclear migration, palld  myo18ab  hoxc8a,https://amp.pharm.mssm.edu/FishEnrichr
,0.025967565595614,3,188,18.2816020025031,Mauthner neuron, hoxc1a  hoxc8a  gap43,https://amp.pharm.mssm.edu/FishEnrichr
,0.025967565595614,3,181,18.9886252843679,Mesonephric nephron, mthfd1l  hoxc1a  pdlim7,https://amp.pharm.mssm.edu/FishEnrichr
,0.025967565595614,3,183,18.7810993249759,Muscle cell cellular homeostasis, palld  pld1a  myo18ab,https://amp.pharm.mssm.edu/FishEnrichr
,0.025967565595614,3,182,18.8842921784098,Muscle cell differentiation, palld  myo18ab  hoxc8a,https://amp.pharm.mssm.edu/FishEnrichr
,0.025967565595614,3,180,19.0941176470588,Regulation of apoptotic process, palld  aqp12  pld1a,https://amp.pharm.mssm.edu/FishEnrichr
,0.025967565595614,3,177,19.4177467597208,Sarcomerogenesis, palld  hoxc8a  pdlim7,https://amp.pharm.mssm.edu/FishEnrichr
,0.025967565595614,3,186,18.4781783681214,Spinal cord development, hoxc1a  hoxc8a  gap43,https://amp.pharm.mssm.edu/FishEnrichr
,0.025967565595614,3,188,18.2816020025031,Terminal nerve, hoxc1a  hoxc8a  gap43,https://amp.pharm.mssm.edu/FishEnrichr
,0.025967565595614,3,183,18.7810993249759,Thalamus development, hoxc1a  hoxc8a  gap43,https://amp.pharm.mssm.edu/FishEnrichr
,0.025967565595614,3,185,18.5780604133545,Ventral spinal nerve, hoxc1a  hoxc8a  gap43,https://amp.pharm.mssm.edu/FishEnrichr
,0.027526169472274,3,194,17.7161916312917,Voltage-gated cation channel activity , cacna1ba  cacng1b  grin3bb, http://amigo.geneontology.org/amigo/term/GO:0022843
,0.029553737983877,3,200,17.1847058823529,WP1337 MAPK Signaling Pathway, mapk14a  cacng1b  nfatc3a,http://www.wikipathways.org/instance/WP1337_r96395
,0.042754190102997,3,237,14.5018615040953,Embryonic organ development, calcr  dio2  pdlim7,https://amp.pharm.mssm.edu/FishEnrichr
,0.042754190102997,3,237,14.5018615040953,Voltage-gated ion channel activity , cacna1ba  cacng1b  grin3bb, http://amigo.geneontology.org/amigo/term/GO:0005244
,0.042918578096557,3,239,14.3805070145213,Voltage-gated channel activity , cacna1ba  cacng1b  grin3bb, http://amigo.geneontology.org/amigo/term/GO:0022832
,0.042918578096557,3,238,14.4409293129016,Actin filament binding , scin  myo18ab  myo16, http://amigo.geneontology.org/amigo/term/GO:0051015
,0.042918578096557,3,240,14.3205882352941,Heart development, mapk14a  dvl2  gap43,https://amp.pharm.mssm.edu/FishEnrichr
,0.044466976085051,3,244,14.0858244937319,MRNA transcription, srebf1  dio2  gap43,https://amp.pharm.mssm.edu/FishEnrichr
,0.050437217230391,3,320,10.7404411764706,Gastrulation, fzd8a  dvl2  pdlim7,https://amp.pharm.mssm.edu/FishEnrichr
,0.050437217230391,3,504,6.81932773109244,Transport of small molecules, slc1a4  aqp12  slc30a6,https://reactome.org/download/current
,0.050437217230391,3,289,11.8925300223896,Neuronal System, cacna1ba  si:dkey-178k16.1  kcnk9,https://reactome.org/download/current
,0.050437217230391,3,472,7.28165503489531,Gated channel activity , cacna1ba  cacng1b  grin3bb, http://amigo.geneontology.org/amigo/term/GO:0022836
,0.050437217230391,3,503,6.83288504268507,Protein-containing complex binding , scin  myo18ab  myo16, http://amigo.geneontology.org/amigo/term/GO:0044877
,0.050437217230391,3,468,7.34389140271493,Metal ion transmembrane transporter activity , cacna1ba  cacng1b  kcnk9, http://amigo.geneontology.org/amigo/term/GO:0046873
,0.050437217230391,3,285,12.0594427244582,Eye development, wif1  dio2  gap43,https://amp.pharm.mssm.edu/FishEnrichr
,0.050437217230391,3,331,10.3835080860139,Neural tube development, ppm1e  dvl2  hoxc8a,https://amp.pharm.mssm.edu/FishEnrichr
,0.051259892496353,3,550,6.24898395721925,Actin cytoskeleton organization , myo18ab  si:dkey-178k16.1  myo16, http://amigo.geneontology.org/amigo/term/GO:0030036
,0.056148303029494,3,575,5.97728900255754,Inorganic cation transmembrane transport , cacna1ba  cacng1b  kcnk9, http://amigo.geneontology.org/amigo/term/GO:0098662
,0.063547029565924,3,609,5.64358157055926,Metal ion transport , cacna1ba  cacng1b  kcnk9, http://amigo.geneontology.org/amigo/term/GO:0030001
,0.065406963869648,3,618,5.56139348943461,Anatomical structure formation involved in morphogenesis , fzd8a  myo18ab  chn1, http://amigo.geneontology.org/amigo/term/GO:0048646
,0.07027789131817,3,641,5.36184270900248,Inorganic ion transmembrane transport , cacna1ba  cacng1b  kcnk9, http://amigo.geneontology.org/amigo/term/GO:0098660
,0.073597237703302,3,654,5.25526173772261,Cation transmembrane transport , cacna1ba  cacng1b  kcnk9, http://amigo.geneontology.org/amigo/term/GO:0098655
,0.006667836087922,2,10,229.129411764706,NADH dehydrogenase (ubiquinone) activity, calcr  ndufaf2,https://amp.pharm.mssm.edu/FishEnrichr
,0.00884250352817,2,12,190.941176470588,Asymmetric localization of PCP proteins, fzd8a  dvl2,https://reactome.org/download/current
,0.018342212555029,2,19,120.594427244582,Blood plasma, srebf1  dio2,https://amp.pharm.mssm.edu/FishEnrichr
,0.025967565595614,2,37,61.9268680445151,PCP/CE pathway, fzd8a  dvl2,https://reactome.org/download/current
,0.025967565595614,2,29,79.0101419878296,Extension, dvl2  gap43,https://amp.pharm.mssm.edu/FishEnrichr
,0.025967565595614,2,37,61.9268680445151,Pkinase, mapk14a  stk10,https://amp.pharm.mssm.edu/FishEnrichr
,0.025967565595614,2,38,60.297213622291,Optokinetic behavior, dio2  chn1,https://amp.pharm.mssm.edu/FishEnrichr
,0.029519873550198,2,45,50.9176470588235,Somite 10, calcr  dio2,https://amp.pharm.mssm.edu/FishEnrichr
,0.031392438045636,2,47,48.7509386733417,Voltage-gated calcium channel complex , cacna1ba  cacng1b, http://amigo.geneontology.org/amigo/term/GO:0005891
,0.035221234851147,2,50,45.8258823529412,WP1349 Wnt Signaling Pathway, prkcha  dvl2,http://www.wikipathways.org/instance/WP1349_r82353
,0.039229848834488,2,53,43.2319644839068,Glucose homeostasis, slc1a4  gap43,https://amp.pharm.mssm.edu/FishEnrichr
,0.040059269029425,2,54,42.4313725490196,Central nervous system, dio2  gap43,https://amp.pharm.mssm.edu/FishEnrichr
,0.040059269029425,2,54,42.4313725490196,Fatty acid metabolic process, srebf1  dio2,https://amp.pharm.mssm.edu/FishEnrichr
,0.040888277773033,2,55,41.6598930481283,Calcium channel complex , cacna1ba  cacng1b, http://amigo.geneontology.org/amigo/term/GO:0034704
,0.040888277773033,2,55,41.6598930481283,Voltage-gated calcium channel activity , cacna1ba  cacng1b, http://amigo.geneontology.org/amigo/term/GO:0005245
,0.041574024294131,2,56,40.9159663865546,Homeobox domain metazoa, hoxc1a  hoxc8a,https://amp.pharm.mssm.edu/FishEnrichr
,0.041574024294131,2,56,40.9159663865546,Protein kinase domain, mapk14a  stk10,https://amp.pharm.mssm.edu/FishEnrichr
,0.042220193485932,2,57,40.1981424148607,Myoblast, myo18ab  gap43,https://amp.pharm.mssm.edu/FishEnrichr
,0.042918578096557,2,59,38.8354935194417,Action potential, wif1  dio2,https://amp.pharm.mssm.edu/FishEnrichr
,0.042918578096557,2,59,38.8354935194417,Nervous system, dio2  gap43,https://amp.pharm.mssm.edu/FishEnrichr
,0.050437217230391,2,173,13.2444746684801,Rhombomere, dvl2  gap43,https://amp.pharm.mssm.edu/FishEnrichr
,0.050437217230391,2,107,21.4139637163277,Rhombomere 1, dvl2  gap43,https://amp.pharm.mssm.edu/FishEnrichr
,0.050437217230391,2,95,24.1188854489164,Somite 14, mapk14a  chn1,https://amp.pharm.mssm.edu/FishEnrichr
,0.050437217230391,2,145,15.8020283975659,Trunk mesenchyme, mapk14a  wif1,https://amp.pharm.mssm.edu/FishEnrichr
,0.050437217230391,2,126,18.1848739495798,Water homeostasis, dio2  gap43,https://amp.pharm.mssm.edu/FishEnrichr
,0.050437217230391,2,73,31.3875906526994,Water transport, srebf1  dio2,https://amp.pharm.mssm.edu/FishEnrichr
,0.050437217230391,2,73,31.3875906526994,"Wnt signaling pathway, planar cell polarity pathway", fzd8a  dvl2,https://amp.pharm.mssm.edu/FishEnrichr
,0.050437217230391,2,169,13.5579533588583,Actin binding, palld  myo18ab,https://amp.pharm.mssm.edu/FishEnrichr
,0.050437217230391,2,176,13.0187165775401,Adherens junction assembly, palld  myo18ab,https://amp.pharm.mssm.edu/FishEnrichr
,0.050437217230391,2,174,13.1683569979716,Adherens junction maintenance, palld  myo18ab,https://amp.pharm.mssm.edu/FishEnrichr
,0.050437217230391,2,169,13.5579533588583,Adherens junction organization, palld  myo18ab,https://amp.pharm.mssm.edu/FishEnrichr
,0.050437217230391,2,116,19.7525354969574,Amyloid precursor protein metabolic process, vmp1  fbxo16,https://amp.pharm.mssm.edu/FishEnrichr
,0.050437217230391,2,178,12.8724388631857,Anatomical system, gap43  chn1,https://amp.pharm.mssm.edu/FishEnrichr
,0.050437217230391,2,179,12.8005257969109,Anterior neural tube, dvl2  hoxc1a,https://amp.pharm.mssm.edu/FishEnrichr
,0.050437217230391,2,174,13.1683569979716,Aorta development, palld  myo18ab,https://amp.pharm.mssm.edu/FishEnrichr
,0.050437217230391,2,162,14.1437908496732,Atrial cardiac muscle cell development, palld  myo18ab,https://amp.pharm.mssm.edu/FishEnrichr
,0.050437217230391,2,165,13.8866310160428,Atrial cardiac muscle cell differentiation, palld  myo18ab,https://amp.pharm.mssm.edu/FishEnrichr
,0.050437217230391,2,164,13.9713055954089,Atrial cardiac muscle tissue morphogenesis, palld  myo18ab,https://amp.pharm.mssm.edu/FishEnrichr
,0.050437217230391,2,170,13.4782006920415,Atrial myocardium, palld  myo18ab,https://amp.pharm.mssm.edu/FishEnrichr
,0.050437217230391,2,167,13.7203240577668,Atrioventricular canal, palld  myo18ab,https://amp.pharm.mssm.edu/FishEnrichr
,0.050437217230391,2,170,13.4782006920415,Atrioventricular canal development, palld  myo18ab,https://amp.pharm.mssm.edu/FishEnrichr
,0.050437217230391,2,171,13.3993808049536,Atrioventricular canal endocardium, palld  myo18ab,https://amp.pharm.mssm.edu/FishEnrichr
,0.050437217230391,2,166,13.8029766123317,Atrioventricular canal morphogenesis, palld  myo18ab,https://amp.pharm.mssm.edu/FishEnrichr
,0.050437217230391,2,172,13.3214774281806,Atrioventricular valve morphogenesis, palld  myo18ab,https://amp.pharm.mssm.edu/FishEnrichr
,0.050437217230391,2,179,12.8005257969109,Axial mesoderm formation, dvl2  hoxc8a,https://amp.pharm.mssm.edu/FishEnrichr
,0.050437217230391,2,174,13.1683569979716,Axon guidance, ldb2a  hoxc1a,https://amp.pharm.mssm.edu/FishEnrichr
,0.050437217230391,2,175,13.0931092436975,Basement membrane organization, palld  myo18ab,https://amp.pharm.mssm.edu/FishEnrichr
,0.050437217230391,2,159,14.4106548279689,Bone mineralization, fzd8a  dvl2,https://amp.pharm.mssm.edu/FishEnrichr
,0.050437217230391,2,185,12.385373608903,CaP motoneuron, hoxc1a  hoxc8a,https://amp.pharm.mssm.edu/FishEnrichr
,0.050437217230391,2,174,13.1683569979716,Cardiac atrium development, palld  myo18ab,https://amp.pharm.mssm.edu/FishEnrichr
,0.050437217230391,2,166,13.8029766123317,Cardiac atrium morphogenesis, palld  myo18ab,https://amp.pharm.mssm.edu/FishEnrichr
,0.050437217230391,2,165,13.8866310160428,Cardiac chamber formation, palld  myo18ab,https://amp.pharm.mssm.edu/FishEnrichr
,0.050437217230391,2,163,14.0570191266691,Cardiac chamber morphogenesis, palld  myo18ab,https://amp.pharm.mssm.edu/FishEnrichr
,0.050437217230391,2,164,13.9713055954089,Cardiac conduction system development, palld  myo18ab,https://amp.pharm.mssm.edu/FishEnrichr
,0.050437217230391,2,166,13.8029766123317,Cardiac jelly, palld  myo18ab,https://amp.pharm.mssm.edu/FishEnrichr
,0.050437217230391,2,168,13.6386554621849,Cardiac muscle, palld  myo18ab,https://amp.pharm.mssm.edu/FishEnrichr
,0.050437217230391,2,162,14.1437908496732,Cardiac muscle adaptation, palld  myo18ab,https://amp.pharm.mssm.edu/FishEnrichr
,0.050437217230391,2,170,13.4782006920415,Cardiac muscle cell, palld  myo18ab,https://amp.pharm.mssm.edu/FishEnrichr
,0.050437217230391,2,171,13.3993808049536,Cardiac muscle cell apoptotic process, palld  myo18ab,https://amp.pharm.mssm.edu/FishEnrichr
,0.050437217230391,2,172,13.3214774281806,Cardiac muscle cell development, palld  myo18ab,https://amp.pharm.mssm.edu/FishEnrichr
,0.050437217230391,2,175,13.0931092436975,Cardiac muscle cell differentiation, palld  myo18ab,https://amp.pharm.mssm.edu/FishEnrichr
,0.050437217230391,2,176,13.0187165775401,Cardiac muscle cell proliferation, palld  myo18ab,https://amp.pharm.mssm.edu/FishEnrichr
